{
  "skill": "obra/systematic-debugging",
  "date": "2026-04-04",
  "sha256": "4999cb851360485eca5074e727bbdd62ef20549c5d5b01216fcbf5831badb473",
  "files_analyzed": [
    "SKILL.md",
    "find-polluter.sh",
    "condition-based-waiting-example.ts",
    "root-cause-tracing.md",
    "defense-in-depth.md",
    "condition-based-waiting.md"
  ],
  "score": 93,
  "verdict": "GREEN",
  "critical_findings": 0,
  "findings": [
    {
      "severity": "HIGH",
      "layer": 1,
      "file": "SKILL.md",
      "line": 1,
      "content": "No allowed-tools declared in frontmatter",
      "explanation": "Missing allowed-tools. find-polluter.sh runs npm test in bisection loop. condition-based-waiting-example.ts is a code example, not an executable script."
    }
  ],
  "layer_scores": {
    "frontmatter": 70,
    "static_patterns": 100,
    "semantic": 100,
    "scripts": 100,
    "data_flow": 100,
    "mcp": 100,
    "supply_chain": 100,
    "reputation": 50,
    "anti_evasion": 100
  },
  "analyzed_by": "skill-guard-v1"
}